{"question": "I'm using Jenkins Rebuild Plugin to execute a parametrized builds with a single Rebuild button. However when I need to rerun dozens of parametrized jobs (either selected, or from the same folder), it's still not efficient. Is there any simpler way (eventually using different plugin) to re-run multiple jobs at the same time using the last used parameters?", "answer": "build job: 'buildjob1', parameters: [ [$class: 'StringParameterValue', name: 'BUILD_NAME', value: ${env.JOB_BASE_NAME}-${env.BUILD_NUMBER}\"], [$class: 'StringParameterValue', name: 'FIXEDPARAM', value: 'some-string'], [$class: 'StringParameterValue', name: 'PARAM1', value: \"${PARAM1}\"] ]", "contexts": ["I'm using Jenkins Rebuild Plugin to execute a parametrized builds with a single Rebuild button. However when I need to rerun dozens of parametrized jobs (either selected, or from the same folder), it's still not efficient. Is there any simpler way (eventually using different plugin) to re-run multiple jobs at the same time using the last used parameters?"], "incident_type": "ci_failure", "source": "https://devops.stackexchange.com/questions/175"}
{"question": "I am attempting to trigger a parameterized Jenkins build from Bamboo, doing the below: POST - http://jenkins-url.com/job/jobname/buildWithParameters?ENVIRONMENT=dev&APPLICATION=hello-world But I will get a 201 instantly which tells me that the build was created. How do I make this request wait and return the success status of the build instead of the fire and forget? It is apparently possible as per Parameterized-Remote-Trigger-Plugin : Edit: created this in the end if you need it. https://github.com/owenmorgan/jenkins-remote-builder", "answer": "jenkins=https://user:pass@jenkins.mydomain.com:8080 jenkins_job=MyApp-Deploy environment=dev application=myapp revision=9fd71f63b351b8208264daf86d292ced580a2f60 ./jenkins_remote_trigger.sh \\ -h ${jenkins} \\ -j ${jenkins_job} \\ -p \"ENVIRONMENT=${environment}&APPLICATION=${application}&REVISION=${revision}\"", "contexts": ["I am attempting to trigger a parameterized Jenkins build from Bamboo, doing the below: POST - http://jenkins-url.com/job/jobname/buildWithParameters?ENVIRONMENT=dev&APPLICATION=hello-world But I will get a 201 instantly which tells me that the build was created. How do I make this request wait and return the success status of the build instead of the fire and forget? It is apparently possible as per Parameterized-Remote-Trigger-Plugin : Edit: created this in the end if you need it. https://github.com/owenmorgan/jenkins-remote-builder"], "incident_type": "ci_failure", "source": "https://devops.stackexchange.com/questions/457"}
{"question": "When using Jenkins to trigger some process (eg a remote build) at a remote location, why would you ever want to \" fire \" something, and then just \" forget \" about the outcome of what got triggered remotely? At least that is what \"fire and forget\" seems to be about. Such \"fire and forget\" sounds like not respecting some of the basic rules in IT: in whatever process (or program, etc) you write, try to always be prepared for unexpected conditions (return codes, etc) that may arise. So that you'll also have appropriate error handling in place. To the extend it does make sense, in the (mainframe) SCM tool that I'm most familiar with, you'd start some FTP process from a dev environment to a remote", "answer": "Don't keep me waiting for the process to complete, so that I can do something else while the process is running. And when the process is done (succeeded or failed), we'll continue processing with whatever is next", "contexts": ["When using Jenkins to trigger some process (eg a remote build) at a remote location, why would you ever want to \" fire \" something, and then just \" forget \" about the outcome of what got triggered remotely? At least that is what \"fire and forget\" seems to be about. Such \"fire and forget\" sounds like not respecting some of the basic rules in IT: in whatever process (or program, etc) you write, try to always be prepared for unexpected conditions (return codes, etc) that may arise. So that you'll also have appropriate error handling in place. To the extend it does make sense, in the (mainframe) SCM tool that I'm most familiar with, you'd start some FTP process from a dev environment to a remote target (eg to distribute and activate executables). And sooner or later (asynchronously) somebody gets some kind of acknowledgement back (from the remote target to the dev site) that indicates \"success or failure\". And if within a reasonable amount of time no feedback at all is returned, you know t"], "incident_type": "ci_failure", "source": "https://devops.stackexchange.com/questions/717"}
{"question": "Is there a way in Groovy directly or by integrating Jenkins plugins to have a downstream job complete only if it hasn't been run in the last X hours already? Let's say I have unit tests, when green, kick off a job to create an image. I want to put an intermediary step between the two that will check to see when the last iteration of the image creation job ran, and if it was less than say 3 hours ago, NOT run the image creation job. There isn't a way to make this work with cron that I can see, since the upstream job runs at random whenever commits are made, obfuscating any timing control. I can't just schedule the image creation because sometimes we get 10+ commits in an hour, and sometimes t", "answer": "long now = System.currentTimeMillis() node('jenkins2_dedicated_slave'){ stage ('check time') { sh '''lastBuild=$(mktemp) curl -u [jenkins username]:[API key for user] \"http://[jenkins URL]/[job name]/lastSuccessfulBuild/api/json\" > $lastBuild jq -j '.timestamp' time.txt''' } archiveArtifacts artifacts: 'time.txt' long lastBuild = readFile('time.txt') as Long int finalNum = (now - lastBuild) / (1000*60*60) if( finalNum < 8 ) { currentBuild.result = 'SUCCESS' echo finalNum + \" hours since the last build. Downstream job not run.\" return } stage ('downstream') { //run downstream job } }", "contexts": ["Is there a way in Groovy directly or by integrating Jenkins plugins to have a downstream job complete only if it hasn't been run in the last X hours already? Let's say I have unit tests, when green, kick off a job to create an image. I want to put an intermediary step between the two that will check to see when the last iteration of the image creation job ran, and if it was less than say 3 hours ago, NOT run the image creation job. There isn't a way to make this work with cron that I can see, since the upstream job runs at random whenever commits are made, obfuscating any timing control. I can't just schedule the image creation because sometimes we get 10+ commits in an hour, and sometimes there's barely one a day. When that single one of the day does turn green I'd rather immediately create an image for use downstream, rather than waiting as much as 3 hours if I schedule it. I'd prefer not to make it a 1:1 ratio commit to image only because storing them gets tricky in large numbers, a"], "incident_type": "ci_failure", "source": "https://devops.stackexchange.com/questions/1014"}
{"question": "There's plenty of questions asking how to return a list of all jobs on your Jenkins instance, or even to get a list of which jobs are currently running, but I have a more specific use-case. I need to see if a single job is already running. As in, return one value if there is 1 builds of the job running, and a different value if 2 or more builds are running. The use case here is that we've automated our image creation to build after successful unit tests. It's set to build a maximum of one image every seven hours, by checking the build time of the last image and cancelling the build if it's been less than 7hrs. This works perfectly for most cases. However, these images take ~20min to build. I", "answer": "http://jenkinsURL/computer/api/xml?tree=computer[executors[currentExecutable[url]],oneOffExecutors[currentExecutable[url]]]&xpath=//url&wrapper=builds", "contexts": ["There's plenty of questions asking how to return a list of all jobs on your Jenkins instance, or even to get a list of which jobs are currently running, but I have a more specific use-case. I need to see if a single job is already running. As in, return one value if there is 1 builds of the job running, and a different value if 2 or more builds are running. The use case here is that we've automated our image creation to build after successful unit tests. It's set to build a maximum of one image every seven hours, by checking the build time of the last image and cancelling the build if it's been less than 7hrs. This works perfectly for most cases. However, these images take ~20min to build. If it's been over 7 hours and two unit tests finish within less than 20min of each other, the second build doesn't see the first creating, and continues building. We're getting two functionally identical images made once every 7hrs, only minutes apart. I'd like to check the status of the controller j"], "incident_type": "ci_failure", "source": "https://devops.stackexchange.com/questions/1537"}
{"question": "In my Jenkins pipeline, I can get change logs of the current build by this. def changeLogSets = currentBuild.changeSets Is there a way to get all change-logs since last successful build?", "answer": "node('my_kubernetes_pod') { passedBuilds = [] lastSuccessfulBuild(passedBuilds, currentBuild); def changeLog = getChangeLog(passedBuilds) echo \"changeLog ${changeLog}\" } def lastSuccessfulBuild(passedBuilds, build) { if ((build != null) && (build.result != 'SUCCESS')) { passedBuilds.add(build) lastSuccessfulBuild(passedBuilds, build.getPreviousBuild()) } } @NonCPS def getChangeLog(passedBuilds) { def log = \"\" for (int x = 0; x < passedBuilds.size(); x++) { def currentBuild = passedBuilds[x]; def changeLogSets = currentBuild.rawBuild.changeSets for (int i = 0; i < changeLogSets.size(); i++) { def entries = changeLogSets[i].items for (int j = 0; j < entries.length; j++) { def entry = entries[j] log += \"* ${entry.msg} by ${entry.author} \\n\" } } } return log; }", "contexts": ["In my Jenkins pipeline, I can get change logs of the current build by this. def changeLogSets = currentBuild.changeSets Is there a way to get all change-logs since last successful build?"], "incident_type": "ci_failure", "source": "https://devops.stackexchange.com/questions/2310"}
{"question": "I have a Docker image, let's call it frontend.image , that I use for a Jenkins build slave. The Jenkins Docker plugin will spin up a container from this image and build artifacts inside the container. This all works great. In this case, the frontend.image is used to build an AngularJs app. Part of building this Angular app is to install npm packages the app requires. This process, npm install, seems to take a long time, 3 minutes it seems, npm always installs every package every time. So I added a volume for my slave, it is a host mounted volume, the Docker plugin will use this volume every time it runs the frontend container: The user that executes the command npm install is jenkins . npm k", "answer": "FROM centos:7 MAINTAINER Brian Ogden # Not currently being used but may come in handy ARG ENVIRONMENT ENV NODE_VERSION 6.11.1 RUN yum -y update && \\ yum clean all && \\ yum -y install http://nginx.org/packages/centos/7/noarch/RPMS/nginx-release-centos-7-0.el7.ngx.noarch.rpm \\ yum -y makecache && \\ yum -y install nginx-1.12.0 wget # Cleanup some default NGINX configuration files we don’t need RUN rm /etc/nginx/conf.d/default.conf ############################################# # NodeJs Install ############################################# #Download NodeJs package RUN wget -q -O - https://nodejs.org/dist/v$NODE_VERSION/node-v$NODE_VERSION-linux-x64.tar.gz \\ | tar --strip-components=1 -xzf - -C /usr/local # https://stackoverflow.com/a/35774741/1258525 # use changes to package.json to force Docker not to use the cache # when we change our application's nodejs dependencies: COPY ./package.json /tmp/package.json RUN cd /tmp && npm install RUN mkdir /app && cp -a /tmp/node_modules /app/ WORKDIR /app COPY . /app RUN npm run build-$ENVIRONMENT RUN cd /app && cp -a dist/* /usr/share/nginx/html COPY ./docker/conf/frontend.conf /etc/nginx/conf.d/frontend.conf COPY ./docker/conf/nginx.conf /etc/nginx/nginx.conf EXPOSE 80 CMD [\"nginx\"]", "contexts": ["I have a Docker image, let's call it frontend.image , that I use for a Jenkins build slave. The Jenkins Docker plugin will spin up a container from this image and build artifacts inside the container. This all works great. In this case, the frontend.image is used to build an AngularJs app. Part of building this Angular app is to install npm packages the app requires. This process, npm install, seems to take a long time, 3 minutes it seems, npm always installs every package every time. So I added a volume for my slave, it is a host mounted volume, the Docker plugin will use this volume every time it runs the frontend container: The user that executes the command npm install is jenkins . npm keeps a cache which you can find with command npm config get cache which outputs /home/jenkins/.npm That is why I have the host volume /slaves/volumes/tsl.frontend:/home/jenkins mounted to my web container slave. I build my Angular app using a Jenkins project, builds no problem, many npm packages are"], "incident_type": "ci_failure", "source": "https://devops.stackexchange.com/questions/2423"}
{"question": "I would like to keep a workspace in Jenkins until after the pull request is merged. Meaning, I don't want to clear the workspace after every build, but I also don't want to clear the workspace only when the branch gets deleted. How can I use the github webhooks to trigger a workspace cleanup whenever a pull request gets resolved as merged? Ideally, the solution would involve using my JenkinsFile/Pipelines. edit: Background. We have long-lived branches and short-lived branches. For brevity, I'll call the long-lived branches \"team branches\". Our workflow is to take short-lived branches, such as feature branches and make a PR request to pull them into the team branches. On Jenkins, we then buil", "answer": "pipeline { agent any stages { stage('Build') { steps { echo 'Building..' } } stage('Test') { steps { echo 'Testing..' } } stage('Deploy') { when { branch 'master' } /* when in master branch */ steps { echo 'Deploying....' deleteDir() /* clean up our workspace */ } } } }", "contexts": ["I would like to keep a workspace in Jenkins until after the pull request is merged. Meaning, I don't want to clear the workspace after every build, but I also don't want to clear the workspace only when the branch gets deleted. How can I use the github webhooks to trigger a workspace cleanup whenever a pull request gets resolved as merged? Ideally, the solution would involve using my JenkinsFile/Pipelines. edit: Background. We have long-lived branches and short-lived branches. For brevity, I'll call the long-lived branches \"team branches\". Our workflow is to take short-lived branches, such as feature branches and make a PR request to pull them into the team branches. On Jenkins, we then build the feature branch and the PR request and the team branch. Normally this works fine, but sometimes when multiple teams are merging to qa each team and feature branch needs to update(pull) and then get built on Jenkins again. Currently, we are always cleaning the workspace which makes the update bu"], "incident_type": "ci_failure", "source": "https://devops.stackexchange.com/questions/3460"}
{"question": "We got gitlab new to our environment and trying to create some CI CD pipelines using gitlab CI. I have got some better progress with running some maven goals, creating pipelines and archiving artifacts using my .gitlab-ci.yml as below. I tried to give give tags after script which doesnt work. Now, I am trying to figure out how can I automate git tags to my sourcecode. I would like to create tag for sourcecode after master branch got successful build. we are using Semantic versions to tag our source code. Finally, so whenever master got successful build I would like to create a tag to my master branch. image: maven:3.5-jdk-8-alpine stages: - build - deploy - tag maven_build: stage: build scri", "answer": "image: maven stages: - build - deploy - tag maven_build: stage: build script: - mvn clean package artifacts: paths: - target/*.jar after_script: - ls -a - cd target && ls -a - git --version - git remote remove origin - git remote set-url origin https://\"username:passwd\"@gitlab.com/accountname/projectname - git tag -a 1.0.15 -m \"Version created by gitlab-ci Build\" - git push origin 1.0.15 only: - master", "contexts": ["We got gitlab new to our environment and trying to create some CI CD pipelines using gitlab CI. I have got some better progress with running some maven goals, creating pipelines and archiving artifacts using my .gitlab-ci.yml as below. I tried to give give tags after script which doesnt work. Now, I am trying to figure out how can I automate git tags to my sourcecode. I would like to create tag for sourcecode after master branch got successful build. we are using Semantic versions to tag our source code. Finally, so whenever master got successful build I would like to create a tag to my master branch. image: maven:3.5-jdk-8-alpine stages: - build - deploy - tag maven_build: stage: build script: - mvn clean package artifacts: paths: - target/*.jar after_script: - ls -a - cd target && ls -a - git --version - git tag -a 1.0.15 -m \"Version created by gitlab-ci Build\" - git push origin 1.0.15 only: - master logs: Running after script... $ ls -a . .. .git .gitignore .gitlab-ci.yml LICENSE RE"], "incident_type": "ci_failure", "source": "https://devops.stackexchange.com/questions/3794"}
{"question": "I want to transfer files and execute a few commands on remote AWS instance from Jenkins. I have the following methods in mind to do the same. Note that my Jenkins server is running in the local server, and I don't have SSH access to Jenkins 1) Using hardcoded pem file I have following scripted pipeline to transfer files from Jenkins pipeline to AWS EC2 instance. stage('transfer docker image to ec2') { sh 'scp -oIdentityFile=/var/lib/jenkins/.key.pem docker_image.tar ubuntu@ec2-3-83-239-32.compute-1.amazonaws.com:' However it is not working, and waiting for a long time without showing logs. 2) Using Jenkins \"credential\" I have added the pem file in Jenkins credential, and then invoked the cre", "answer": "node(master) { stage(Deploy) { sshPublisher(publishers: [sshPublisherDesc(configName: 'SERVER_NAME', transfers: [sshTransfer(cleanRemote: false, excludes: '', execCommand: 'apt-get update', execTimeout: 120000, flatten: false, makeEmptyDirs: false, noDefaultExcludes: false, patternSeparator: '[, ]+', remoteDirectory: '', remoteDirectorySDF: false, removePrefix: '', sourceFiles: '*.war')], usePromotionTimestamp: false, useWorkspaceInPromotion: false, verbose: false)]) } }", "contexts": ["I want to transfer files and execute a few commands on remote AWS instance from Jenkins. I have the following methods in mind to do the same. Note that my Jenkins server is running in the local server, and I don't have SSH access to Jenkins 1) Using hardcoded pem file I have following scripted pipeline to transfer files from Jenkins pipeline to AWS EC2 instance. stage('transfer docker image to ec2') { sh 'scp -oIdentityFile=/var/lib/jenkins/.key.pem docker_image.tar ubuntu@ec2-3-83-239-32.compute-1.amazonaws.com:' However it is not working, and waiting for a long time without showing logs. 2) Using Jenkins \"credential\" I have added the pem file in Jenkins credential, and then invoked the credential by the following method. (Referred from - https://stackoverflow.com/a/47627460/9403545 ) withCredentials([sshUserPrivateKey(credentialsId: \"bindu-test\", keyFileVariable: 'keyfile')]) { stage('transfer docker image to ec2') { sh 'scp -i ${keyfile} test ubuntu@ec2-x-83-xxx-32.compute-1.amazona"], "incident_type": "ci_failure", "source": "https://devops.stackexchange.com/questions/5949"}
{"question": "We have got test automation in Jenkins, and we would like to execute it at midnight. But sometimes it fails, and sometimes it passes. Our idea is to execute the daily builds from 1:00 AM until it is green. How we can execute a job until it is green? For example: Execute job at 1:00 Execute job at 2:00 if the previous is green, etc. We can run it hourly, but how is it possible to insert the condition?", "answer": "pipeline { agent any triggers { cron('0 1 * * *') } stages { stage ('Build') { when { expression { // When last build has failed !hudson.model.Result.SUCCESS.equals(currentBuild.rawBuild.getPreviousBuild()?.getResult()) == true } } steps { sh \"./myjob.sh\" } post { failure { // If the current job has failed, trigger it without // waiting. build job: \"${JOB_NAME}\", wait: false } } } } }", "contexts": ["We have got test automation in Jenkins, and we would like to execute it at midnight. But sometimes it fails, and sometimes it passes. Our idea is to execute the daily builds from 1:00 AM until it is green. How we can execute a job until it is green? For example: Execute job at 1:00 Execute job at 2:00 if the previous is green, etc. We can run it hourly, but how is it possible to insert the condition?"], "incident_type": "ci_failure", "source": "https://devops.stackexchange.com/questions/8958"}
{"question": "I'm running Conda 4.6.14 on Ubuntu 16.04. I thought about using virtual environments with Conda in my Jenkins pipelines that needed Ansible, by having all nodes use the same environment, ansible-env to run playbooks. While the process seems pretty straight forward, I'm unable to call conda activate ansible-env , because it results in the following error: + conda activate ansible-env CommandNotFoundError: Your shell has not been properly configured to use 'conda activate'. To initialize your shell, run $ conda init <SHELL_NAME> Currently supported shells are: - bash - fish - tcsh - xonsh - zsh - powershell See 'conda init --help' for more information and options. IMPORTANT: You may need to cl", "answer": "sh '''#!/usr/bin/env bash wget https://repo.continuum.io/miniconda/Miniconda3-latest-Linux-x86_64.sh -nv -O miniconda.sh bash miniconda.sh -b -p $WORKSPACE/miniconda conda config --set always_yes yes --set changeps1 no conda update -q conda conda env create -f envs/ansible-env.yaml '''", "contexts": ["I'm running Conda 4.6.14 on Ubuntu 16.04. I thought about using virtual environments with Conda in my Jenkins pipelines that needed Ansible, by having all nodes use the same environment, ansible-env to run playbooks. While the process seems pretty straight forward, I'm unable to call conda activate ansible-env , because it results in the following error: + conda activate ansible-env CommandNotFoundError: Your shell has not been properly configured to use 'conda activate'. To initialize your shell, run $ conda init <SHELL_NAME> Currently supported shells are: - bash - fish - tcsh - xonsh - zsh - powershell See 'conda init --help' for more information and options. IMPORTANT: You may need to close and restart your shell after running 'conda init'. Here is the code I'm using to activate...pretty basic sh(\"conda activate ansible-env\") sh(\"ansible --version\") sh(\"conda deactivate\") I ran conda init --system on the build node as the Jenkins user and then rebooted. No change. I've spent a grea"], "incident_type": "ci_failure", "source": "https://devops.stackexchange.com/questions/10421"}
{"question": "I integrate the existing kubernetes cluster to the gitlab instance (omnibus). I get the below error in the deployment stage of CI/CD pipeline: Error from server (Forbidden): error when retrieving current configuration of: Resource: \"apps/v1, Resource=deployments\", GroupVersionKind: \"apps/v1, Kind=Deployment\" Name: \"test-deployment\", Namespace: \"default\" Object: &{map[\"apiVersion\":\"apps/v1\" \"kind\":\"Deployment\" \"metadata\":map[\"annotations\":map[\"kubectl.kubernetes.io/last-applied-configuration\":\"\"] \"name\":\"test-deployment\" \"namespace\":\"default\"] \"spec\":map[\"replicas\":'\\x01' \"selector\":map[\"matchLabels\":map[\"app\":\"test\"]] \"template\":map[\"metadata\":map[\"labels\":map[\"app\":\"test\"]] \"spec\":map[\"cont", "answer": "apiVersion: v1 kind: ServiceAccount metadata: name: gitlab-admin namespace: kube-system --- apiVersion: rbac.authorization.k8s.io/v1beta1 kind: ClusterRoleBinding metadata: name: gitlab-admin-binding roleRef: apiGroup: rbac.authorization.k8s.io kind: ClusterRole name: deployment-reader subjects: - kind: ServiceAccount name: gitlab-admin namespace: kube-system", "contexts": ["I integrate the existing kubernetes cluster to the gitlab instance (omnibus). I get the below error in the deployment stage of CI/CD pipeline: Error from server (Forbidden): error when retrieving current configuration of: Resource: \"apps/v1, Resource=deployments\", GroupVersionKind: \"apps/v1, Kind=Deployment\" Name: \"test-deployment\", Namespace: \"default\" Object: &{map[\"apiVersion\":\"apps/v1\" \"kind\":\"Deployment\" \"metadata\":map[\"annotations\":map[\"kubectl.kubernetes.io/last-applied-configuration\":\"\"] \"name\":\"test-deployment\" \"namespace\":\"default\"] \"spec\":map[\"replicas\":'\\x01' \"selector\":map[\"matchLabels\":map[\"app\":\"test\"]] \"template\":map[\"metadata\":map[\"labels\":map[\"app\":\"test\"]] \"spec\":map[\"containers\":[map[\"env\":[map[\"name\":\"OHH_COMMON_REDEPLOY\" \"value\":\"Sun Feb 9 13:55:45 +0330 2020\"]] \"image\":\"192.168.10.6:5000/majid/hello-world:v0.01\" \"name\":\"test\" \"ports\":[map[\"containerPort\":'P']]]]]]]]} from server for: \"deployment.yaml\": deployments.apps \"test-deployment\" is forbidden: User \"system"], "incident_type": "ci_failure", "source": "https://devops.stackexchange.com/questions/10751"}
{"question": "Jenkins version is 2.235.5 (I should update it to next LTS version 2.249). I configured Jenkins to run a job periodically every 30 days: Build Triggers → Build periodically → Schedule: H 3 */30 * * And now I see: Would last have run at Saturday, October 31, 2020 3:20:39 AM EDT; would next run at Sunday, November 1, 2020 3:20:39 AM EST. So it will be started again after 1 day, not 30 days… How to run a job periodically every 30 days? Update: history of Jenkins \"predictions\" for schedule above (job was created October 28): Would last have run at Thursday, October 1, 2020 3:20:06 AM EDT; would next run at Saturday, October 31, 2020 3:20:06 AM EDT. Would last have run at Saturday, October 31, 20", "answer": "MINUTES Minutes in one hour (0-59) HOURS Hours in one day (0-23) DAYMONTH Day in a month (1-31) MONTH Month in a year (1-12) DAYWEEK Day of the week (0-7) where 0 and 7 are sunday", "contexts": ["Jenkins version is 2.235.5 (I should update it to next LTS version 2.249). I configured Jenkins to run a job periodically every 30 days: Build Triggers → Build periodically → Schedule: H 3 */30 * * And now I see: Would last have run at Saturday, October 31, 2020 3:20:39 AM EDT; would next run at Sunday, November 1, 2020 3:20:39 AM EST. So it will be started again after 1 day, not 30 days… How to run a job periodically every 30 days? Update: history of Jenkins \"predictions\" for schedule above (job was created October 28): Would last have run at Thursday, October 1, 2020 3:20:06 AM EDT; would next run at Saturday, October 31, 2020 3:20:06 AM EDT. Would last have run at Saturday, October 31, 2020 3:20:39 AM EDT; would next run at Sunday, November 1, 2020 3:20:39 AM EST. Would last have run at Sunday, November 1, 2020 3:20:43 AM EST; would next run at Tuesday, December 1, 2020 3:20:43 AM EST."], "incident_type": "ci_failure", "source": "https://devops.stackexchange.com/questions/12677"}
{"question": "I know that I can't have multiple gitlab-ci.yml files in one repo, but it still seems fairly limited. Say for example I have one set of tests I want to run whenever a change is pushed or on PRs, and another set I want to run every 24 hours. Is there a way to do that, or do I only get one set of tests I have to use whenever I want to run CI?", "answer": "job1: script: - do something on schedule only rules: - if: '\"$CI_PIPELINE_SOURCE\" == \"schedule\"' when: always job2: script: - runs on Merge request pipeline rules: - if: $CI_MERGE_REQUEST_ID when: always when: never job2: script: - runs on changes to anything in src directory or Dockerfile rules: - changes: - src/* - Dockerfile", "contexts": ["I know that I can't have multiple gitlab-ci.yml files in one repo, but it still seems fairly limited. Say for example I have one set of tests I want to run whenever a change is pushed or on PRs, and another set I want to run every 24 hours. Is there a way to do that, or do I only get one set of tests I have to use whenever I want to run CI?"], "incident_type": "ci_failure", "source": "https://devops.stackexchange.com/questions/13357"}
{"question": "My ansible playbook has a task named 'Copy the build script to the system and run it'. It is prone to errors, so I've created a debug task to debug it: - name: Copy the build script to the system and run it template: src: build3.sh.j2 dest: \"{{ yocto3_env_user_home }}/build3.sh\" owner: \"{{ yocto3_env_user }}\" mode: 0755 - command: \"/bin/su -l {{ yocto3_env_user }} -c '{{ yocto3_env_user_home }}/build3.sh'\" register: script_output # Creating a variable from the output of the task async: 28800 poll: 300 - debug: var: script_output # Debugging the variable created above However, when the 'yocto3-env' task fails, ansible halts and doesn't proceed to the debug task, which causes me to miss out on", "answer": "- script: | sudo -- sh -c -e \"echo '{ASE's Private IP} {ASE Name}.appserviceenvironment.net' >> /etc/hosts\"; sudo -- sh -c -e \"echo '{ASE's Private IP} scm.{ASE Name}.appserviceenvironment.net' >> /etc/hosts\"; sudo -- sh -c -e \"echo '{ASE's Private IP} {AppName}.scm.{ASE Name}.appserviceenvironment.net' >> /etc/hosts\"; displayName: 'Fake DNS entries required for deployment'", "contexts": ["My ansible playbook has a task named 'Copy the build script to the system and run it'. It is prone to errors, so I've created a debug task to debug it: - name: Copy the build script to the system and run it template: src: build3.sh.j2 dest: \"{{ yocto3_env_user_home }}/build3.sh\" owner: \"{{ yocto3_env_user }}\" mode: 0755 - command: \"/bin/su -l {{ yocto3_env_user }} -c '{{ yocto3_env_user_home }}/build3.sh'\" register: script_output # Creating a variable from the output of the task async: 28800 poll: 300 - debug: var: script_output # Debugging the variable created above However, when the 'yocto3-env' task fails, ansible halts and doesn't proceed to the debug task, which causes me to miss out on the debugging output as it can be seen below. What could be potential reason for that? (Please note that my ansible runs in a docker container in a CI/CD pipeline) TASK [yocto3-env : Copy the build script to the system and run it] ************* changed: [3.236.191.93] TASK [yocto3-env : command] **"], "incident_type": "ci_failure", "source": "https://devops.stackexchange.com/questions/14807"}
{"question": "I am new to Ansible. When I am using ec2.py dynamic inventory to generate inventory, after the playbook is finished to run, the results are shown as list of IP addresses under specific tag with underscore instead of dot. For example I want to run a playbook on instances with specific tag, I wonder how other people work with IP addresses? --- - hosts: tag_test_staging sudo: true tasks: - name: Make sure that we can connect to the machine ping: PLAY RECAP ********************************************************************* 10_80_20_47 : ok=0 changed=0 unreachable=1 failed=0 For private address, ec2.ini: hostname_variable = private_ip_address destination_variable = private_ip_address vpc_desti", "answer": "#hostname_variable = private_ip_address #hostname_variable = ip_address destination_variable = public_dns_name vpc_destination_variable = private_ip_address", "contexts": ["I am new to Ansible. When I am using ec2.py dynamic inventory to generate inventory, after the playbook is finished to run, the results are shown as list of IP addresses under specific tag with underscore instead of dot. For example I want to run a playbook on instances with specific tag, I wonder how other people work with IP addresses? --- - hosts: tag_test_staging sudo: true tasks: - name: Make sure that we can connect to the machine ping: PLAY RECAP ********************************************************************* 10_80_20_47 : ok=0 changed=0 unreachable=1 failed=0 For private address, ec2.ini: hostname_variable = private_ip_address destination_variable = private_ip_address vpc_destination_variable = private_ip_address The results from ec2.py: \"tag_test_staging\": [ \"10_80_20_47\" ], For Public Address, ec2.ini: hostname_variable = ip_address destination_variable = public_dns_name vpc_destination_variable = ip_address The results from ec2.py: \"tag_test_staging\": [ \"52_28_11_11\" ]"], "incident_type": "deploy_regression", "source": "https://devops.stackexchange.com/questions/313"}
{"question": "I plan to reconfigure iptables on our servers (mostly CentOS 7, some CentOS 6) with different network configurations, some on 1Gbit interface, some on 10Gbit, some with VLANs and some with configured LACP. I want to use Ansible, but couldn't find how to detect what inteface has private address. Private address we could get from inventory as ansible_ssh_host . Is there any Ansible module that could help? Or I should write shell/Python script? I checked all solutions on StackOverflow and ServerFault but haven't found anything.", "answer": "#!/usr/bin/python # encoding: utf-8 import subprocess from ansible.module_utils.basic import * from netaddr import IPNetwork def get_priv_interface_info_for_ip(ip): network_config = subprocess.Popen([\"/usr/sbin/ip\", \"-o\", \"addr\", \"show\"], stdout=subprocess.PIPE) result = network_config.stdout.read() interface = \"\" network = '' ip_addr = ip for str in result.split(\"\\n\"): if 'inet ' in str: if ip in str: interface = str[3:str.find(\" \", 3)] network = IPNetwork(str[str.find(\"net\", 3) + 4:str.find(\"/\", 3) + 3]).cidr return interface, ip_addr, network def get_pub_interface_info_for_ip(ip): network_config = subprocess.Popen([\"/usr/sbin/ip\", \"-o\", \"addr\", \"show\"], stdout=subprocess.PIPE) result = network_config.stdout.read() interface = '' network = '' ip_addr = '' for str in result.split(\"\\n\"): if 'inet ' in str: if ip not in str and '127.0.0.1' not in str: print str interface = str[3:str.find(\" \", 3)] network = IPNetwork(str[str.find(\"net\", 3) + 4:str.find(\"/\", 3) + 3]).cidr ip_addr = str[str.find(\"net\", 3) + 4:str.find(\"/\", 3)] return interface, ip_addr, network def main(argv=None): if argv is None: argv = sys.argv fields = {\"ip\": {\"required\": True, \"type\": \"str\"}} module = AnsibleModule(argument_spec=fields) my_ip = module.params['ip'] ifname_priv, ip_priv, network_priv = get_priv_interface_info_for_ip(my_ip) ifname_pub, ip_pub, network_pub = get_pub_interface_info_for_ip(my_ip) mo", "contexts": ["I plan to reconfigure iptables on our servers (mostly CentOS 7, some CentOS 6) with different network configurations, some on 1Gbit interface, some on 10Gbit, some with VLANs and some with configured LACP. I want to use Ansible, but couldn't find how to detect what inteface has private address. Private address we could get from inventory as ansible_ssh_host . Is there any Ansible module that could help? Or I should write shell/Python script? I checked all solutions on StackOverflow and ServerFault but haven't found anything."], "incident_type": "deploy_regression", "source": "https://devops.stackexchange.com/questions/1313"}
{"question": "I'm new to Ansible. Here's my task ... I have 400+ hosts, and I need to verify if 5 different ports are open from their end to our web server. Individually, I could log in and run: telnet mywebserver.com 443 telnet mywebserver.com 80 telnet mywebserver.com 8443 ..and so on.. What module or plugin could be used in Ansible so I could automate this, and have it report the results (whether open or closed ports) back to my Ansible server?", "answer": "- name: Check all port numbers are accessible from the current host wait_for: host: mywebserver.com port: \"{{ item }}\" state: started # Port should be open delay: 0 # No wait before first check (sec) timeout: 3 # Stop checking after timeout (sec) ignore_errors: yes with_items: - 443 - 80 - 80443", "contexts": ["I'm new to Ansible. Here's my task ... I have 400+ hosts, and I need to verify if 5 different ports are open from their end to our web server. Individually, I could log in and run: telnet mywebserver.com 443 telnet mywebserver.com 80 telnet mywebserver.com 8443 ..and so on.. What module or plugin could be used in Ansible so I could automate this, and have it report the results (whether open or closed ports) back to my Ansible server?"], "incident_type": "deploy_regression", "source": "https://devops.stackexchange.com/questions/1658"}
{"question": "Finally, you are so much in love with Docker that you want to move your online business-critical production systems with sensitive customer data to a Docker Swarm. Some might even already have done so. The other organization can't afford it by a policy forbidding production processes running in root mode. What could be a checklist of building blocks to consider for a Docker production environment? One does not need all of them, but all of them should be important to be assessed. Disclaimer: I know there is a SE policy to avoid \"large endless lists\" but I think this checklist cannot be very big... and endless noway. So - what are these buildings blocks? If not already deployed, consider runni", "answer": "docker run -it --net host --pid host --cap-add audit_control \\ -e DOCKER_CONTENT_TRUST=$DOCKER_CONTENT_TRUST \\ -v /var/lib:/var/lib \\ -v /var/run/docker.sock:/var/run/docker.sock \\ -v /usr/lib/systemd:/usr/lib/systemd \\ -v /etc:/etc --label docker_bench_security \\ docker/docker-bench-security", "contexts": ["Finally, you are so much in love with Docker that you want to move your online business-critical production systems with sensitive customer data to a Docker Swarm. Some might even already have done so. The other organization can't afford it by a policy forbidding production processes running in root mode. What could be a checklist of building blocks to consider for a Docker production environment? One does not need all of them, but all of them should be important to be assessed. Disclaimer: I know there is a SE policy to avoid \"large endless lists\" but I think this checklist cannot be very big... and endless noway. So - what are these buildings blocks? If not already deployed, consider running a Linux host system with advanced security settings - hardened kernel, SELinux etc. Consider using a tiny Docker base image, like alpine, busybox or even scratch e.g. start with an empty base image Use USER setting other than root Carefully assess to further reduce the already shrinked set of ker"], "incident_type": "deploy_regression", "source": "https://devops.stackexchange.com/questions/1943"}
{"question": "I'm having issues working out how to best apply hosts/roles to different operating systems in Ansible. I'm currently using Ansible to generate Windows/Mac/Linux VMs, and each of the VMs have different roles which need to be applied to them. I've read the best practices and have tried to follow them, especially to use the grouping method, but I'm still unsure as they mostly mention webservers and dbservers. site.yml - name: Apply common configuration to all nodes hosts: all roles: - common - name: Configure and deploy test node 1 hosts: build-test-node roles: - build-machine-test-1 - name: Configure and deploy test node 2 hosts: build-test-node-2 roles: - build-machine-test-2 environments/tes", "answer": "- name: Apply common configuration to all nodes hosts: all roles: - common - name: Configure and deploy test node 1 hosts: build-test-node roles: - build-machine-test-1 - name: Configure and deploy test node 2 hosts: build-test-node-2 roles: - build-machine-test-2", "contexts": ["I'm having issues working out how to best apply hosts/roles to different operating systems in Ansible. I'm currently using Ansible to generate Windows/Mac/Linux VMs, and each of the VMs have different roles which need to be applied to them. I've read the best practices and have tried to follow them, especially to use the grouping method, but I'm still unsure as they mostly mention webservers and dbservers. site.yml - name: Apply common configuration to all nodes hosts: all roles: - common - name: Configure and deploy test node 1 hosts: build-test-node roles: - build-machine-test-1 - name: Configure and deploy test node 2 hosts: build-test-node-2 roles: - build-machine-test-2 environments/test/groups [win_build_nodes] win_build_machine_1 win_build_machine_2 [mac_build_nodes] mac_build_machine_1 environments/test/hosts win_build_machine_1 ansible_host=...... win_build_machine_2 ansible_host=...... mac_build_machine_1 ansible_host=...... environments/test/meta [mac_build_nodes] [win_build"], "incident_type": "deploy_regression", "source": "https://devops.stackexchange.com/questions/1981"}
{"question": "Currently I build my app with maven and use the tomcat manager to hot deploy the war file (both on windows servers). Now I want to use ansible to move away from the manual process. Would it make sense to build with ansible? My assumption is, that it does not. How could I use the tomcat manager to hot deploy, triggered by ansible. I have searched the web but I did not find a solution. Is there an other option to hot deploy the war file, which I might have overseen?", "answer": "### This play deploys a webapp war to an tomcat server - name: Copy the war file {{ webapp_name }}.war as {{ webapp_name }}.war.tmp to {{ webapp_destination_folder }} win_copy: src: files/{{ webapp_name }}.war dest: \"{{ webapp_destination_folder }}\\\\{{ webapp_name }}.war.tmp\" force: yes - name: Remove current war file {{ webapp_destination_folder }}\\{{ webapp_name }}.war win_file: path: \"{{ webapp_destination_folder }}\\\\{{ webapp_name }}.war\" state: absent - name: Wait until the webapp folder {{ webapp_destination_folder }}\\{{ webapp_name }} is deleted win_wait_for: path: \"{{ webapp_destination_folder }}\\\\{{ webapp_name }}xxx\" state: absent register: folder_info - name: rename the {{ webapp_name }}.war.tmp to {{ webapp_name }}.war win_command: \"cmd.exe /c rename {{ webapp_destination_folder }}\\\\{{ webapp_name }}.war.tmp {{ webapp_name }}.war\" register: cmd_result", "contexts": ["Currently I build my app with maven and use the tomcat manager to hot deploy the war file (both on windows servers). Now I want to use ansible to move away from the manual process. Would it make sense to build with ansible? My assumption is, that it does not. How could I use the tomcat manager to hot deploy, triggered by ansible. I have searched the web but I did not find a solution. Is there an other option to hot deploy the war file, which I might have overseen?"], "incident_type": "deploy_regression", "source": "https://devops.stackexchange.com/questions/2834"}
{"question": "I am relatively inexperienced when it comes to Ansible however I have previously created playbooks which will create a cron job successfully. For the life of me I cannot work out what is wrong with my .yml file. I am receiving the below error when attempting to run my playbook locally with: ansible-playbook -i \"localhost,\" -c local crond.yml ERROR! 'cron' is not a valid attribute for a Play The error appears to have been in '/etc/ansible/cds/roles/backups/tasks/crond.yml': line 3, column 3, but may be elsewhere in the file depending on the exact syntax problem. The offending line appears to be: - cron: ^ here I have seen similar questions asked on SE/Ansible forums but to no avail. Any help/", "answer": "- cron: name: \"Copy all rsnapshot backups from \" minute: \"30\" hour: \"02\" job: \"/usr/bin/rsync -avhz -e \\\"ssh\\\" --rsync-path=\\\"sudo rsync\\\" -H --delete --numeric-ids :\\\"/data/rsnapshot-backups/ \\\" /data/rsnapshot-backup\" user: root cron_file: rsync.cron state: present", "contexts": ["I am relatively inexperienced when it comes to Ansible however I have previously created playbooks which will create a cron job successfully. For the life of me I cannot work out what is wrong with my .yml file. I am receiving the below error when attempting to run my playbook locally with: ansible-playbook -i \"localhost,\" -c local crond.yml ERROR! 'cron' is not a valid attribute for a Play The error appears to have been in '/etc/ansible/cds/roles/backups/tasks/crond.yml': line 3, column 3, but may be elsewhere in the file depending on the exact syntax problem. The offending line appears to be: - cron: ^ here I have seen similar questions asked on SE/Ansible forums but to no avail. Any help/guidance would be much appreciated. Here is my crond.yml file: - cron: user: \"root\" minute: \"30\" hour: \"02\" job: '{{/usr/bin/rsync -avhz -e \"ssh\" --rsync-path=\"sudo rsync\" -H --delete --numeric-ids <ipaddress>:\"/data/rsnapshot-backups/<ipaddress>\" /data/rsnapshot-backup}}' state: present"], "incident_type": "deploy_regression", "source": "https://devops.stackexchange.com/questions/3213"}
{"question": "My company is moving from an architecture of \"many projects on a single webserver\" to a Kubernetes cluster with multiple different hosted web applications in a single cluster. In order to make integration of new customers easy, I want an UI to clone a 'template' code repository and give it a new life. When creating a new client from this interface, it would also create a Kubernetes deployment in a staging cluster, clone a database and possibly do other automated tasks. I thought of rolling my own interface that would manage my Kubernetes deployments so I could tailor it exactly to the requirements, then I looked up GitLab and figured somebody was probably doing just that already. Having neve", "answer": "aws events put-rule --name Test --event-pattern \"{\\\"source\\\":[\\\"aws.guardduty\\\"],\\\"detail-type\\\":[\\\"GuardDuty Finding\\\"],\\\"detail\\\":{\\\"severity\\\":[7.0,7.1,7.2,7.3,7.4,7.5,7.6,7.7,7.8,7.9,8.0,8.1,8.2,8.3,8.4,8.5,8.6,8.7,8.8,8.9,7,8]}}\"", "contexts": ["My company is moving from an architecture of \"many projects on a single webserver\" to a Kubernetes cluster with multiple different hosted web applications in a single cluster. In order to make integration of new customers easy, I want an UI to clone a 'template' code repository and give it a new life. When creating a new client from this interface, it would also create a Kubernetes deployment in a staging cluster, clone a database and possibly do other automated tasks. I thought of rolling my own interface that would manage my Kubernetes deployments so I could tailor it exactly to the requirements, then I looked up GitLab and figured somebody was probably doing just that already. Having never used GitLab, would it suit my use case? Once the initial setup is done, I would actually use it for its intended purpose so I know it'll be good for that at least. Question 2: Can I edit Kubernetes deployment configs from GitLab, such as changing replica count or RAM limit while it's running?"], "incident_type": "deploy_regression", "source": "https://devops.stackexchange.com/questions/3626"}
{"question": "I'm deploying an instance with kubernetes on Azure public cloud, and I need a tool to monitor the microservices and pods inside this instance, the question is, what tool are you using to do that? I've been searching in a couple of places but without success.", "answer": "# launch three PostgreSQL instances for i in {1..3}; do docker run --rm -d -P postgres:alpine done # show port mappings for each container docker container ls -q --filter=\"ancestor=postgres:alpine\" | xargs -n1 docker port 5432/tcp -> 0.0.0.0:32773 5432/tcp -> 0.0.0.0:32772 5432/tcp -> 0.0.0.0:32771", "contexts": ["I'm deploying an instance with kubernetes on Azure public cloud, and I need a tool to monitor the microservices and pods inside this instance, the question is, what tool are you using to do that? I've been searching in a couple of places but without success."], "incident_type": "deploy_regression", "source": "https://devops.stackexchange.com/questions/3745"}
{"question": "I have an issue with amazon free tier account, I have deployed two EC2 instances (1 linux and 1 windows) on amazon each having 30GB of storage which is permissible under free tier, these instances are continuously running 24/7 so that they are always available,what I don't understand is that starting last month I have had charges to my account for exceeding cloud storage usage that have left me confused. I have read details on Free Tier more than 5 times but I still can't understand what I'm doing wrong, checked the Cost Explorer, the only thing that comes to mind is perhaps the 30GB is applied universally for all instances but I am not sure as I don't know how my account usage is calculated", "answer": "FROM ubuntu:xenial RUN useradd -d /home/ubuntu -ms /bin/bash -g root -G sudo -p ubuntu ubuntu RUN mkdir /opt/myvolume && chown ubuntu /opt/myvolume WORKDIR /home/ubuntu VOLUME /opt/myvolume", "contexts": ["I have an issue with amazon free tier account, I have deployed two EC2 instances (1 linux and 1 windows) on amazon each having 30GB of storage which is permissible under free tier, these instances are continuously running 24/7 so that they are always available,what I don't understand is that starting last month I have had charges to my account for exceeding cloud storage usage that have left me confused. I have read details on Free Tier more than 5 times but I still can't understand what I'm doing wrong, checked the Cost Explorer, the only thing that comes to mind is perhaps the 30GB is applied universally for all instances but I am not sure as I don't know how my account usage is calculated. I have tried contacting support assistant but I am yet to receive any response from them. I would really appreciate if someone helped set some things straight because I have hit a wall with this one."], "incident_type": "deploy_regression", "source": "https://devops.stackexchange.com/questions/4546"}
{"question": "So I'm automating a process we currently have where we deploy a database and then have an exe that 'activates' the database. The default values are different for each product and is determined by a cmd line arg. I've created 3 VSTS Release environments based on the hardware IO board for the environment. How can I pass in this product flag at deploy time as it isn't dependent on the environment or release itself. Edit: The product flag value isn't known until the database is deployed into an environment, and value can not be set in the release definition creation time or at release time. Only when deployed into a particular environemnt", "answer": "FROM ubuntu:xenial RUN useradd -d /home/ubuntu -ms /bin/bash -g root -G sudo -p ubuntu ubuntu RUN mkdir /opt/myvolume && chown ubuntu /opt/myvolume WORKDIR /home/ubuntu VOLUME /opt/myvolume", "contexts": ["So I'm automating a process we currently have where we deploy a database and then have an exe that 'activates' the database. The default values are different for each product and is determined by a cmd line arg. I've created 3 VSTS Release environments based on the hardware IO board for the environment. How can I pass in this product flag at deploy time as it isn't dependent on the environment or release itself. Edit: The product flag value isn't known until the database is deployed into an environment, and value can not be set in the release definition creation time or at release time. Only when deployed into a particular environemnt"], "incident_type": "deploy_regression", "source": "https://devops.stackexchange.com/questions/4553"}
{"question": "I have 3 scripts that must be run on server one by one. for example: - name: find config shell: /data/scripts/config1 become: yes become_user: root tags: find_config - name: change config shell: /data/scripts/config2 become: yes become_user: root tags: change_config - name: confirm config shell: /data/scripts/config3 become: yes become_user: dbusr1 tags: confirm_config in second script config2 there is a reboot command and then the rest of script will be run at start up. something like this: some variables . . commands before reboot . . reboot command . . commands that run at start up does this reboot affect ansible tasks? how i can write tasks that wait until commands that run at start up b", "answer": "--- - name: System Reboot hosts: debian become_method: sudo become_user: root become: true tasks: - name: reboot nodes # Reboot client side debian machine shell: sleep 2 && shutdown -r now \"Ansible reboot\" async: 1 poll: 0 ignore_errors: true - name: wait for the server to come back # when server timeout it through error. That error is handle by ignore_errors. local_action: wait_for args: host: \"{{ inventory_hostname }}\" port: 22 state: started delay: 120 timeout: 200 ignore_errors: true", "contexts": ["I have 3 scripts that must be run on server one by one. for example: - name: find config shell: /data/scripts/config1 become: yes become_user: root tags: find_config - name: change config shell: /data/scripts/config2 become: yes become_user: root tags: change_config - name: confirm config shell: /data/scripts/config3 become: yes become_user: dbusr1 tags: confirm_config in second script config2 there is a reboot command and then the rest of script will be run at start up. something like this: some variables . . commands before reboot . . reboot command . . commands that run at start up does this reboot affect ansible tasks? how i can write tasks that wait until commands that run at start up be run then execute config3 ? is this even possible in ansible? what modules should i use?"], "incident_type": "deploy_regression", "source": "https://devops.stackexchange.com/questions/8725"}
{"question": "Aim The aim is to run docker-compose in BitBucket pipelines Attempt bitbucket-pipelines.yml image: docker/compose:1.12.0 pipelines: default: - step: script: - docker-compose up --build Outcome The Docker Engine version is less than the minimum required by Compose. Your current project requires a Docker Engine of version 1.13.0 or greater. Discussion According to this post it is not supported?", "answer": "pipelines: default: - step: script: - export DOCKER_COMPOSE_VERSION=1.18.0 - export DOCKER_COMPOSE_URL=https://github.com/docker/compose/releases/download/${DOCKER_COMPOSE_VERSION}/docker-compose-$(uname -s)-$(uname -m) - curl -L $DOCKER_COMPOSE_URL > docker-compose - chmod +x docker-compose - mv docker-compose /usr/local/bin - docker-compose build --force-rm --no-cache --pull", "contexts": ["Aim The aim is to run docker-compose in BitBucket pipelines Attempt bitbucket-pipelines.yml image: docker/compose:1.12.0 pipelines: default: - step: script: - docker-compose up --build Outcome The Docker Engine version is less than the minimum required by Compose. Your current project requires a Docker Engine of version 1.13.0 or greater. Discussion According to this post it is not supported?"], "incident_type": "edge_case", "source": "https://devops.stackexchange.com/questions/795"}
{"question": "I'm trying to create a dummy state in Salt to pull dependencies from a list derived from a pillar. In my top.sls file, I have: base: '*': - components Then, in components.sls , I have: {% if 'components' in pillar.items() %} include: {% for component in pillar.get('components',[]) %} - {{ component }} {% endfor %} {% endif %} {% if 'components' in pillar.items() %} components: require: {% for component in pillar.get('components',[]) %} - {{ component }} {% endfor %} {% endif %} When I check the pillar contents, I see: $ salt my-minion-id pillar.items my-minion-id: ---------- components: - a-dependency-name But when I try to see the set of states, I see: $ salt my-minion-id state.show_sls com", "answer": "{% if 'components' in salt.pillar.items() %} include: {% for component in salt.pillar.get('components').keys() %} - {{ component }} {% endfor %} {% endif %}", "contexts": ["I'm trying to create a dummy state in Salt to pull dependencies from a list derived from a pillar. In my top.sls file, I have: base: '*': - components Then, in components.sls , I have: {% if 'components' in pillar.items() %} include: {% for component in pillar.get('components',[]) %} - {{ component }} {% endfor %} {% endif %} {% if 'components' in pillar.items() %} components: require: {% for component in pillar.get('components',[]) %} - {{ component }} {% endfor %} {% endif %} When I check the pillar contents, I see: $ salt my-minion-id pillar.items my-minion-id: ---------- components: - a-dependency-name But when I try to see the set of states, I see: $ salt my-minion-id state.show_sls components my-minion-id: ---------- ...and that's it. My ultimate goal, here, is to treat the minion as hostile, so I'm trying to pull role details out of pillars instead of assigning roles in my file_root 's top.sls . It's my understanding that every minion has full access to the contents of the file_"], "incident_type": "edge_case", "source": "https://devops.stackexchange.com/questions/945"}
{"question": "I am wondering if there is a resource to download multiple files from remote using chef resource. I want to use: remote_file 'Download remote file' do path /opt/ source http:///xxx mode '0644' action :create end ...for one file. What if I want to download multiple files in a same place with different urls? Or how can I modify this resource to make multiple downloads which have different URLs? This is how I added attributes in recipe: node['file']['name'].each do |pkg| remote_file \"path/plugins/#{pkg}\" do source \"node['file']['url']/#{pkg}\" action :create end end in attributes default['file']['name'] = %w( xx-2.0.jar xx-2.jar xx.jar )", "answer": "%w{ mysql-community-common-5.7.16-1.el7.x86_64.rpm mysql-community-libs-5.7.16-1.el7.x86_64.rpm mysql-community-client-5.7.16-1.el7.x86_64.rpm mysql-community-server-5.7.16-1.el7.x86_64.rpm }.each do |pkg| remote_file \"/tmp/#{pkg}\" do source \"https://s3.amazonaws.com/tmp/mysql/#{pkg}\" end rpm_package pkg do source \"/tmp/#{pkg}\" action :install end end", "contexts": ["I am wondering if there is a resource to download multiple files from remote using chef resource. I want to use: remote_file 'Download remote file' do path /opt/ source http:///xxx mode '0644' action :create end ...for one file. What if I want to download multiple files in a same place with different urls? Or how can I modify this resource to make multiple downloads which have different URLs? This is how I added attributes in recipe: node['file']['name'].each do |pkg| remote_file \"path/plugins/#{pkg}\" do source \"node['file']['url']/#{pkg}\" action :create end end in attributes default['file']['name'] = %w( xx-2.0.jar xx-2.jar xx.jar )"], "incident_type": "edge_case", "source": "https://devops.stackexchange.com/questions/1048"}
{"question": "There is a great question here about how to get a list of encrypted disks . I'm currently using the describe-volumes command. For the record I'm currently using: aws ec2 describe-volumes --region us-east-1 --filters Name=encrypted,Values=false Name=attachment.status,Values=attached --query \"length(Volumes[])\" What I want is to filter that down further to just the instances that are running. (ie exclude the ones that are stopped). My question is: How can I get a list of encrypted disks for instances that are running on the AWS CLI?", "answer": "for instance in $instances; do count=`aws ec2 describe-volumes --filters Name=attachment.status,Values=attached Name=attachment.instance-id,Values=$instance --query \"Volumes[]\" | jq -r '. | length';` name=`aws ec2 describe-tags --filters Name=resource-id,Values=$instance Name=key,Values=Name --query Tags[].Value | jq -r '.[0]'` if [ $count -gt 0 ]; then START=0 END=$count for ((i=START; i<END; i++)) do #echo \"i: $i\" encrypted=`aws ec2 describe-volumes --filters Name=attachment.status,Values=attached Name=attachment.instance-id,Values=$instance --query \"Volumes[]\" | jq -r \".[$i].Encrypted\";` volumeid=`aws ec2 describe-volumes --filters Name=attachment.status,Values=attached Name=attachment.instance-id,Values=$instance --query \"Volumes[]\" | jq -r \".[$i].VolumeId\";` echo \"$instance $name Volumes: $count VolumeId: $volumeid Encrypted: $encrypted \" done fi done", "contexts": ["There is a great question here about how to get a list of encrypted disks . I'm currently using the describe-volumes command. For the record I'm currently using: aws ec2 describe-volumes --region us-east-1 --filters Name=encrypted,Values=false Name=attachment.status,Values=attached --query \"length(Volumes[])\" What I want is to filter that down further to just the instances that are running. (ie exclude the ones that are stopped). My question is: How can I get a list of encrypted disks for instances that are running on the AWS CLI?"], "incident_type": "edge_case", "source": "https://devops.stackexchange.com/questions/1186"}
{"question": "I am building an AWS CodePipeline which depends on two source repositories. If the 'CodeBuild' step is specified with multiple Input artifacts, then you get the error: .. declares 2 input artifacts which is more than the maximum count . Documentation has a strict requirement for CodeBuild to have only a single input artifact. Lambdas, on another hand, do not have this limitation. I've been looking for a way how a Lambda could \"merge\" two artifacts into a single one which I can pass to the CodeBuild then. Unfortunately, information on this subject is quite limited. Does anyone have a working CodePipeline Lambda which would merge two Artifacts into one? Note : Documentation about How to access", "answer": "{ \"name\": \"sample-project\", \"source\": { \"type\": \"S3\", \"location\": \"bucket/sample.zip\" }, \"secondarySources\": [ { \"type\": \"CODECOMMIT\", \"location\": \"https://git-codecommit.us-west-2.amazonaws.com/v1/repos/repo\" \"sourceIdentifier\": \"source1\" }, { \"type\": \"GITHUB\", \"location\": \"https://github.com/awslabs/aws-codebuild-jenkins-plugin\" \"sourceIdentifier\": \"source2\" } ],", "contexts": ["I am building an AWS CodePipeline which depends on two source repositories. If the 'CodeBuild' step is specified with multiple Input artifacts, then you get the error: .. declares 2 input artifacts which is more than the maximum count . Documentation has a strict requirement for CodeBuild to have only a single input artifact. Lambdas, on another hand, do not have this limitation. I've been looking for a way how a Lambda could \"merge\" two artifacts into a single one which I can pass to the CodeBuild then. Unfortunately, information on this subject is quite limited. Does anyone have a working CodePipeline Lambda which would merge two Artifacts into one? Note : Documentation about How to access artifacts ."], "incident_type": "edge_case", "source": "https://devops.stackexchange.com/questions/1538"}
{"question": "I have a list of buckets in AWS S3. I have created an IAM user. I have an option to provide S3 full or read only access for a user using groups. Is there any options to provide access only to a particular bucket?", "answer": "{ \"Version\": \"2012-10-17\", \"Statement\": [ { \"Effect\": \"Allow\", \"Action\": [\"s3:ListBucket\"], \"Resource\": [\"arn:aws:s3:::test\"] }, { \"Effect\": \"Allow\", \"Action\": [ \"s3:PutObject\", \"s3:GetObject\", \"s3:DeleteObject\" ], \"Resource\": [\"arn:aws:s3:::test/*\"] } ] }", "contexts": ["I have a list of buckets in AWS S3. I have created an IAM user. I have an option to provide S3 full or read only access for a user using groups. Is there any options to provide access only to a particular bucket?"], "incident_type": "edge_case", "source": "https://devops.stackexchange.com/questions/1626"}
{"question": "I'm trying to run wordpress inside docker. I've been following this tutorial : https://www.sitepoint.com/how-to-use-the-official-docker-wordpress-image/ But when I run this command : docker run -e WORDPRESS_DB_PASSWORD=xxxxxx -d --name wordpress --link wordpressdb:mysql -p 127.0.0.1:8080:80 -v \"$PWD/\":/var/www/html wordpress The container crashes, and in the logs I can see things like : tar: ./wp-admin: Cannot mkdir: Permission denied", "answer": "#!/bin/bash # remove images docker rmi $(docker images -q) # remove containers docker stop $(docker ps -aq) docker rm $(docker ps -aq) # remove volumes docker volume rm $(docker volume ls -q) echo \"Type mysql root password : \" read mspass docker run --name wordpressdb -e MYSQL_ROOT_PASSWORD=$mspass -e MYSQL_DATABASE=wordpress -d mysql:5.7 docker run -e WORDPRESS_DB_PASSWORD=$mspass --name wordpress --link wordpressdb:mysql -p 127.0.0.2:8080:80 -v \"$PWD/\":/var/www/html -d wordpress", "contexts": ["I'm trying to run wordpress inside docker. I've been following this tutorial : https://www.sitepoint.com/how-to-use-the-official-docker-wordpress-image/ But when I run this command : docker run -e WORDPRESS_DB_PASSWORD=xxxxxx -d --name wordpress --link wordpressdb:mysql -p 127.0.0.1:8080:80 -v \"$PWD/\":/var/www/html wordpress The container crashes, and in the logs I can see things like : tar: ./wp-admin: Cannot mkdir: Permission denied"], "incident_type": "edge_case", "source": "https://devops.stackexchange.com/questions/1795"}
{"question": "I have multiple AWS accounts and I need to list all S3 buckets per account and then view each buckets total size. Currently, I can only view the storage size of a single S3 bucket with: aws s3 ls s3://mybucket --recursive --human-readable --summarize", "answer": "#!/bin/bash aws_profile=('profile1' 'profile2' 'profile3'); #loop AWS profiles for i in \"${aws_profile[@]}\"; do echo \"${i}\" buckets=($(aws s3 ls s3:// --recursive --profile \"${i}\" --region your_region | awk '{print $3}')) #loop S3 buckets for j in \"${buckets[@]}\"; do echo \"${j}\" aws s3 ls s3://\"${j}\" --recursive --human-readable --summarize --profile \"${i}\" --region your_region | awk END'{print}' done done", "contexts": ["I have multiple AWS accounts and I need to list all S3 buckets per account and then view each buckets total size. Currently, I can only view the storage size of a single S3 bucket with: aws s3 ls s3://mybucket --recursive --human-readable --summarize"], "incident_type": "edge_case", "source": "https://devops.stackexchange.com/questions/2241"}
{"question": "Currently, I'm going to need an implementation that must find all files within a directory and start a parallel task for every file found. Is it possible to achieve this using declarative pipelines? pipeline { agent any stages { stage(\"test\") { steps { dir (\"file_path\") { // find all files with complete path parallel ( // execute parallel tasks for each file found. // this must be dynamic } } } } } } }", "answer": "pipeline { agent { label \"master\"} stages { stage('1') { steps { script { def tests = [:] for (f in findFiles(glob: '**/html/*.html')) { tests[\"${f}\"] = { node { stage(\"${f}\") { echo '${f}' } } } } parallel tests } } } } }", "contexts": ["Currently, I'm going to need an implementation that must find all files within a directory and start a parallel task for every file found. Is it possible to achieve this using declarative pipelines? pipeline { agent any stages { stage(\"test\") { steps { dir (\"file_path\") { // find all files with complete path parallel ( // execute parallel tasks for each file found. // this must be dynamic } } } } } } }"], "incident_type": "edge_case", "source": "https://devops.stackexchange.com/questions/3073"}
{"question": "I want to edit my CloudWatch rule so that it only triggers an SNS topic for \"GuardDuty findings\" that fall in the High severy range, defined by AWS as the value of the severity parameter in the GetFindings response falls within the 7.0 to 8.9 range . The sample Event Pattern in the documentation only shows how to create a trigger for severities 5 and 8 as follows: { \"source\": [ \"aws.guardduty\" ], \"detail-type\": [ \"GuardDuty Finding\" ], \"detail\": { \"severity\": [ 5, 8 ] } } How do I change this { \"severity\": [ 5, 8 ] } to be a range between 7.0 to 8.9?", "answer": "aws events put-rule --name Test --event-pattern \"{\\\"source\\\":[\\\"aws.guardduty\\\"],\\\"detail-type\\\":[\\\"GuardDuty Finding\\\"],\\\"detail\\\":{\\\"severity\\\":[7.0,7.1,7.2,7.3,7.4,7.5,7.6,7.7,7.8,7.9,8.0,8.1,8.2,8.3,8.4,8.5,8.6,8.7,8.8,8.9,7,8]}}\"", "contexts": ["I want to edit my CloudWatch rule so that it only triggers an SNS topic for \"GuardDuty findings\" that fall in the High severy range, defined by AWS as the value of the severity parameter in the GetFindings response falls within the 7.0 to 8.9 range . The sample Event Pattern in the documentation only shows how to create a trigger for severities 5 and 8 as follows: { \"source\": [ \"aws.guardduty\" ], \"detail-type\": [ \"GuardDuty Finding\" ], \"detail\": { \"severity\": [ 5, 8 ] } } How do I change this { \"severity\": [ 5, 8 ] } to be a range between 7.0 to 8.9?"], "incident_type": "edge_case", "source": "https://devops.stackexchange.com/questions/3622"}
{"question": "I have been using docker for a few months and I am just a developer not a DevOps or a networking person. However, I came across a docker-compose which maps an external port to an internal port. Something like in this compose file where it says: ports: - 8080:80 My question is WHY? Why do we need to map an external port to internal port. Some of the explanation that I came across was that if you want to not expose a particular port to the user but use it internally. That also begs the same question: what would be a real life example of someone wanting to do this and why?", "answer": "# launch three PostgreSQL instances for i in {1..3}; do docker run --rm -d -P postgres:alpine done # show port mappings for each container docker container ls -q --filter=\"ancestor=postgres:alpine\" | xargs -n1 docker port 5432/tcp -> 0.0.0.0:32773 5432/tcp -> 0.0.0.0:32772 5432/tcp -> 0.0.0.0:32771", "contexts": ["I have been using docker for a few months and I am just a developer not a DevOps or a networking person. However, I came across a docker-compose which maps an external port to an internal port. Something like in this compose file where it says: ports: - 8080:80 My question is WHY? Why do we need to map an external port to internal port. Some of the explanation that I came across was that if you want to not expose a particular port to the user but use it internally. That also begs the same question: what would be a real life example of someone wanting to do this and why?"], "incident_type": "edge_case", "source": "https://devops.stackexchange.com/questions/3733"}
{"question": "I want to ask for input but only if we are on a certain branch. But the input is run before the when. Can this be done with declarative syntax? For example this will always prompt even when the branch is not master stage('only on master') { when { branch 'master' } input { ... } }", "answer": "CURRENT_BRANCH = '...' // some value or parameter stage('only on master') { if (CURRENT_BRANCH == 'master') { input { ... } } // be sure to check if input was set or define a default value", "contexts": ["I want to ask for input but only if we are on a certain branch. But the input is run before the when. Can this be done with declarative syntax? For example this will always prompt even when the branch is not master stage('only on master') { when { branch 'master' } input { ... } }"], "incident_type": "edge_case", "source": "https://devops.stackexchange.com/questions/3951"}
{"question": "I'm generating CSV strings for various 3rd party utilities and this section of code gets repeated in many classes. Is there a better way to generate this string? public override string CsvString() { return ( string.Format(\"\\u0022{0}\\u0022,\\u0022{1}\\u0022,\\u0022{2}\\u0022,\\u0022{3}\\u0022,\\u0022{4}\\u0022,\\u0022{5}\\u0022,\\u0022{6}\\u0022,\\u0022{7}\\u0022,\\u0022{8}\\u0022,\\u0022{9}\\u0022,\\u0022{10}\\u0022,\\u0022{11}\\u0022,\\u0022{12}\\u0022,\\u0022{13}\\u0022\", this.BlockType, // 1, A_NAME this.Tag, // 2, A_TAG this.Description, // 3, A_DESC this.InitialScan, // 4, A_ISCAN this.AutoManual, // 5, A_SCAN this.ScanTime, // 6, A_SCANT this.IoDevice, // 7, A_IODV this.IoAddress, // 8, A_IOAD this.InitialAmSta", "answer": "var properties = new Object[] { this.BlockType, // 1, A_NAME this.Tag, // 2, A_TAG this.Description, // 3, A_DESC this.InitialScan, // 4, A_ISCAN this.AutoManual, // 5, A_SCAN this.ScanTime, // 6, A_SCANT this.IoDevice, // 7, A_IODV this.IoAddress, // 8, A_IOAD this.InitialAmStatus, // 9, A_IAM this.AlarmPriority, // 10, A_PRI this.AlarmEnable, // 11, A_ENAB this.EnableOutput, // 12, A_EOUT this.HistDescription, // 13, A_HIST_DESC this.SecurityArea1 // 14, A_SECURITYAREA1 }.Select(x => String.Format(\"\\u0022{0}\\u0022\", x)); return String.Join(\",\", properties);", "contexts": ["I'm generating CSV strings for various 3rd party utilities and this section of code gets repeated in many classes. Is there a better way to generate this string? public override string CsvString() { return ( string.Format(\"\\u0022{0}\\u0022,\\u0022{1}\\u0022,\\u0022{2}\\u0022,\\u0022{3}\\u0022,\\u0022{4}\\u0022,\\u0022{5}\\u0022,\\u0022{6}\\u0022,\\u0022{7}\\u0022,\\u0022{8}\\u0022,\\u0022{9}\\u0022,\\u0022{10}\\u0022,\\u0022{11}\\u0022,\\u0022{12}\\u0022,\\u0022{13}\\u0022\", this.BlockType, // 1, A_NAME this.Tag, // 2, A_TAG this.Description, // 3, A_DESC this.InitialScan, // 4, A_ISCAN this.AutoManual, // 5, A_SCAN this.ScanTime, // 6, A_SCANT this.IoDevice, // 7, A_IODV this.IoAddress, // 8, A_IOAD this.InitialAmStatus, // 9, A_IAM this.AlarmPriority, // 10, A_PRI this.AlarmEnable, // 11, A_ENAB this.EnableOutput, // 12, A_EOUT this.HistDescription, // 13, A_HIST_DESC this.SecurityArea1 // 14, A_SECURITYAREA1 )); }"], "incident_type": "pr_stale", "source": "https://codereview.stackexchange.com/questions/36"}
{"question": "I implemented the Shamos-Hoey algorithm to check if a closed shape is self-intersected. Is this algorithm ok in terms of performance? public boolean isSelfIntersected() { Set<Line2D> plines = new HashSet<Line2D>(); for (Path2D ps : this.getPath()) { PathIterator p_it = ps.getPathIterator(null, /*flatness*/ 1); List<Line2D> estPath = new ArrayList<Line2D>(); while (!p_it.isDone()) { p_it.next(); double[] coords = new double[6]; int s = p_it.currentSegment(coords); if (s == PathIterator.SEG_LINETO) { if (estPath.size() != 0) { Point2D pp = estPath.get(estPath.size() - 1).getP2(); estPath.add(new Line2D.Double(pp, new Point2D.Double(coords[0],coords[1]))); } else { estPath.add(new Line2D.Double", "answer": "if (li.getX1() li.getX2()) { Line2D l = new Line2D.Double(li.getP2(), li.getP1()); events.add(new AlgEvent(l, true)); events.add(new AlgEvent(l, false)); } else { if (li.getY1() li.getY2()) { Line2D l = new Line2D.Double(li.getP2(), li.getP1()); events.add(new AlgEvent(l, true)); events.add(new AlgEvent(l, false)); } else // ...", "contexts": ["I implemented the Shamos-Hoey algorithm to check if a closed shape is self-intersected. Is this algorithm ok in terms of performance? public boolean isSelfIntersected() { Set<Line2D> plines = new HashSet<Line2D>(); for (Path2D ps : this.getPath()) { PathIterator p_it = ps.getPathIterator(null, /*flatness*/ 1); List<Line2D> estPath = new ArrayList<Line2D>(); while (!p_it.isDone()) { p_it.next(); double[] coords = new double[6]; int s = p_it.currentSegment(coords); if (s == PathIterator.SEG_LINETO) { if (estPath.size() != 0) { Point2D pp = estPath.get(estPath.size() - 1).getP2(); estPath.add(new Line2D.Double(pp, new Point2D.Double(coords[0],coords[1]))); } else { estPath.add(new Line2D.Double(new Point2D.Double(), new Point2D.Double(coords[0],coords[1]))); } } } for (Line2D lq : estPath) { plines.add(tweakLine(lq)); } } return ShamosHoeyAlgorithm(plines); } /** * Moves first point of the line by 0.0000001 of it's length. * @return */ static Line2D tweakLine(Line2D l) { Line2D ql = new L"], "incident_type": "pr_stale", "source": "https://codereview.stackexchange.com/questions/69"}
{"question": "Is this the best way to implement this pattern in C#? public sealed class Singleton { private static readonly Singleton instance = new Singleton(); public static Singleton Instance { get { return instance; } } static Singleton() {} private Singleton() {} }", "answer": "public sealed class Singleton { // Thread safe Singleton with fully lazy instantiation á la Jon Skeet: // http://csharpindepth.com/Articles/General/Singleton.aspx Singleton() { } public static Singleton Instance { get { return Nested.instance; } } class Nested { // Explicit static constructor to tell C# compiler // not to mark type as beforefieldinit static Nested() { } internal static readonly Singleton instance = new Singleton(); } }", "contexts": ["Is this the best way to implement this pattern in C#? public sealed class Singleton { private static readonly Singleton instance = new Singleton(); public static Singleton Instance { get { return instance; } } static Singleton() {} private Singleton() {} }"], "incident_type": "pr_stale", "source": "https://codereview.stackexchange.com/questions/79"}
{"question": "So I have a series of objects, which I will call Impl1, Impl2, and Impl3. They each implement an interface, called IImpl. I have a Factory class who's task is to retrieve the ImplX which is appropriate for a given circumstance, and pass it on to its callers. So the code in the factory looks like: public IImpl GetInstance(params object[] args) { if (args[0]==\"Some Value\") return new IImpl1(); else if (args[0]==\"Other Value\") return new IImpl2(args[1]); else return new IImpl3(args[1]); } So depending on the arguments passed in, different instances are selected. All well and good and works ok. The problem now is, that I have a class which needs to call this factory method. It has no references ", "answer": "// client code: Blackboard blackboard = new Blackboard(); blackboard.pushCollectionB(collectionB); blackboard.pushCollectionC(collectionC); blackboard.pushFoo(foo); IImpl myInstance = Factory.GetInstance(b); /////////////////////////// // in Factory.GetInstance(): return new Impl3(blackboard); //////////////////////////// // in Impl3: Impl3(Blackboard b) { process(b.getCollectionC()); }", "contexts": ["So I have a series of objects, which I will call Impl1, Impl2, and Impl3. They each implement an interface, called IImpl. I have a Factory class who's task is to retrieve the ImplX which is appropriate for a given circumstance, and pass it on to its callers. So the code in the factory looks like: public IImpl GetInstance(params object[] args) { if (args[0]==\"Some Value\") return new IImpl1(); else if (args[0]==\"Other Value\") return new IImpl2(args[1]); else return new IImpl3(args[1]); } So depending on the arguments passed in, different instances are selected. All well and good and works ok. The problem now is, that I have a class which needs to call this factory method. It has no references to IImplX, which is good, but it winds up having to know exactly how to construct the input array to GetInstance, in order to ensure it receives the correct kind of instance. Code winds up looking like: switch (_selectedInputEnum) { case InputType.A: myIImplInst = Factory.GetInstance(\"Some Value\"); "], "incident_type": "pr_stale", "source": "https://codereview.stackexchange.com/questions/128"}
{"question": "Is this code good enough, or is it stinky? using System; using System.Collections.Generic; using System.Linq; using System.Text; using System.IO; namespace DotNetLegends { public class LogParser { /// <summary> /// Returns a populated Game objects that has a list of players and other information. /// </summary> /// <param name=\"pathToLog\">Path to the .log file.</param> /// <returns>A Game object.</returns> public Game Parse(string pathToLog) { Game game = new Game(); //On actual deployment of this code, I will use the pathToLog parameter. StreamReader reader = new StreamReader(@\"D:\\Games\\Riot Games\\League of Legends\\air\\logs\\LolClient.20110121.213758.log\"); var content = reader.ReadToEnd(); ", "answer": "protected string GetFieldContent(string content, string field, int padding, int length) { var location = content.indexOf(field); padding += field.Length; var fieldVal = content.Substring(location + padding, length); fieldVal = fieldVal.Trim(); return fieldVal; }", "contexts": ["Is this code good enough, or is it stinky? using System; using System.Collections.Generic; using System.Linq; using System.Text; using System.IO; namespace DotNetLegends { public class LogParser { /// <summary> /// Returns a populated Game objects that has a list of players and other information. /// </summary> /// <param name=\"pathToLog\">Path to the .log file.</param> /// <returns>A Game object.</returns> public Game Parse(string pathToLog) { Game game = new Game(); //On actual deployment of this code, I will use the pathToLog parameter. StreamReader reader = new StreamReader(@\"D:\\Games\\Riot Games\\League of Legends\\air\\logs\\LolClient.20110121.213758.log\"); var content = reader.ReadToEnd(); game.Id = GetGameID(content); game.Length = GetGameLength(content); game.Map = GetGameMap(content); game.MaximumPlayers = GetGameMaximumPlayers(content); game.Date = GetGameDate(content); return game; } internal string GetGameID(string content) { var location = content.IndexOf(\"gameId\"); var gameID "], "incident_type": "pr_stale", "source": "https://codereview.stackexchange.com/questions/164"}
{"question": "In this question I answered with this Linq. While it does what I was looking for, I am not sure how easy the linq queries are for others to follow. So I am looking for feedback on formating, what comments would be helpful and other alternative approaches to moving through the children records. private void UpdateGridFromSourceHierarchy(int depth, IEnumerable<SourceFile> list) { //Get the initial set of sourcefiles var sourceFiles = list .SelectMany(current => current.getInvocations() .Select(invocation => new {current = (SourceFile) null, invocation})) .ToList() //This ensures that getInvocations is only called once for each sourcefile .GroupBy(x => x.current, x => x.invocation); for (var cu", "answer": "var sourceFiles = from file in list from invocation in file.getInvocations() group invocation by (SourceFile)null into groupedByInvoker select groupedByInvoker; for (var currentDepth = 0; currentDepth < depth; currentDepth++) { foreach (var invokerGroup in sourceFiles) { int sourceFileCount = currentGroup.Count(); int counter = 0; foreach (var invocation in invokerGroup) { // Do stuff counter++; } } sourceFiles = from invokerGroup in sourceFiles from file in invokerGroup from invocation in file.getInvocations() group invocation by file into groupedByInvoker select groupedByInvoker; }", "contexts": ["In this question I answered with this Linq. While it does what I was looking for, I am not sure how easy the linq queries are for others to follow. So I am looking for feedback on formating, what comments would be helpful and other alternative approaches to moving through the children records. private void UpdateGridFromSourceHierarchy(int depth, IEnumerable<SourceFile> list) { //Get the initial set of sourcefiles var sourceFiles = list .SelectMany(current => current.getInvocations() .Select(invocation => new {current = (SourceFile) null, invocation})) .ToList() //This ensures that getInvocations is only called once for each sourcefile .GroupBy(x => x.current, x => x.invocation); for (var currentDepth = 0; currentDepth <= depth; currentDepth++) { foreach (var currentGroup in sourceFiles) { int sourceFileCount = currentGroup.Count(); int counter = 0; foreach (var invocation in currentGroup) { /* * Generalized grid code goes here * In my code it was a call to: * UpdateGridPosition(curren"], "incident_type": "pr_stale", "source": "https://codereview.stackexchange.com/questions/182"}
{"question": "Imagine that I need a color palette for my Winforms application to have a consistent look. What I did was create a static helper class and helper methods that I can call from anywhere in my code, and invoke what I need from the App.settings file. Here for example, I am getting the school name from the App.config file, so I can sell this application to other schools with minimal changes on my part. <?xml version=\"1.0\" encoding=\"utf-8\" ?> <configuration> <appSettings> <add key=\"schoolName\" value=\"Uboldi\"/> </appSettings> </configuration> using System; using System.Collections.Generic; using System.Linq; using System.Text; using System.Configuration; namespace Uboldi.Helpers { public static cla", "answer": "public class UboldiConfigurationSection : System.Configuration.ConfigurationSection { [ConfigurationProperty(\"schoolName\")] public string SchoolName { get { return (string)this[\"schoolName\"]; } set { this[\"schoolName\"] = value; } } }", "contexts": ["Imagine that I need a color palette for my Winforms application to have a consistent look. What I did was create a static helper class and helper methods that I can call from anywhere in my code, and invoke what I need from the App.settings file. Here for example, I am getting the school name from the App.config file, so I can sell this application to other schools with minimal changes on my part. <?xml version=\"1.0\" encoding=\"utf-8\" ?> <configuration> <appSettings> <add key=\"schoolName\" value=\"Uboldi\"/> </appSettings> </configuration> using System; using System.Collections.Generic; using System.Linq; using System.Text; using System.Configuration; namespace Uboldi.Helpers { public static class CustomizationHelper { public static string GetSchoolName() { return ConfigurationManager.AppSettings[\"schoolName\"]; } } } Usage: using System; using System.Collections.Generic; using System.ComponentModel; using System.Data; using System.Drawing; using System.Linq; using System.Text; using System"], "incident_type": "pr_stale", "source": "https://codereview.stackexchange.com/questions/186"}
{"question": "I've got a flat array of < 1000 items and I need to find the indices of a smaller tuple/array within the array. The tuple to find can be a varying length (generally between 2 and 5 items, order is important). This is my initial naive implementation. My main concerns are: This seems like a CS 101 problem, so I'm pretty sure I'm overdoing it. Readability. I can break this down into smaller methods, but it's essentially a utility function in a much larger class. I guess I could extract it into its own class, but that feels like overkill as well. As-is, it's just too long for me to grok the whole thing in one pass. public int[] findIndices(final Object[] toSearch, final Object[] toFind) { Object", "answer": "// assumes no null entries // returns starting index of first occurrence of needle within haystack or -1 public int indexOf(final Object[] haystack, final Object[] needle) { foo: for (int a = 0; a < haystack.length - needle.length; a++) { for (int b = 0; b < needle.length; b++) { if (!haystack[a+b].equals(needle[b])) continue foo; } return a; } return -1; }", "contexts": ["I've got a flat array of < 1000 items and I need to find the indices of a smaller tuple/array within the array. The tuple to find can be a varying length (generally between 2 and 5 items, order is important). This is my initial naive implementation. My main concerns are: This seems like a CS 101 problem, so I'm pretty sure I'm overdoing it. Readability. I can break this down into smaller methods, but it's essentially a utility function in a much larger class. I guess I could extract it into its own class, but that feels like overkill as well. As-is, it's just too long for me to grok the whole thing in one pass. public int[] findIndices(final Object[] toSearch, final Object[] toFind) { Object first = toFind[0]; List<Integer> possibleStartIndices = new ArrayList<Integer>(); int keyListSize = toFind.length; for (int i = 0; i <= toSearch.length - keyListSize; i++) { if (first.equals(toSearch[i])) { possibleStartIndices.add(i); } } int[] indices = new int[0]; for (int startIndex : possibleS"], "incident_type": "pr_stale", "source": "https://codereview.stackexchange.com/questions/278"}
{"question": "Similar piece of code to that I recently posted as: Resolving a link I have another piece of code which cannot be as easily extracted out into a method: #define THROW_LAST_WINDOWS_ERROR()\\ WindowsApi::Exception::Throw(::GetLastError(), __FILE__, __LINE__) #define THROW_MANUAL_WINDOWS_ERROR(x)\\ WindowsApi::Exception::Throw(x, __FILE__, __LINE__) Process CreateNormalProcess( ProcessSnapshot *parent, const UNICODE_STRING& name, const unsigned __int32 pid, const std::vector<ToolHelpThread>& threads ) { std::wstring nameStr(name.Buffer, name.Length/sizeof(wchar_t)); std::wstring commandLine; std::wstring mainModulePath; std::wstring error; std::vector<Module> modules; try { using WindowsApi::Dll:", "answer": "#define D3DCALL(a) { auto __ = a; if (FAILED(__)) DXTrace(__FILE__, __LINE__, __, WIDEN(#a), TRUE); } D3DCALL(D3DXCreateSphere( D3DDev.get(), radius, slices, slices, &retval->Mesh._Myptr, &retval->Adjacency._Myptr ));", "contexts": ["Similar piece of code to that I recently posted as: Resolving a link I have another piece of code which cannot be as easily extracted out into a method: #define THROW_LAST_WINDOWS_ERROR()\\ WindowsApi::Exception::Throw(::GetLastError(), __FILE__, __LINE__) #define THROW_MANUAL_WINDOWS_ERROR(x)\\ WindowsApi::Exception::Throw(x, __FILE__, __LINE__) Process CreateNormalProcess( ProcessSnapshot *parent, const UNICODE_STRING& name, const unsigned __int32 pid, const std::vector<ToolHelpThread>& threads ) { std::wstring nameStr(name.Buffer, name.Length/sizeof(wchar_t)); std::wstring commandLine; std::wstring mainModulePath; std::wstring error; std::vector<Module> modules; try { using WindowsApi::Dll::NtDll; using WindowsApi::AutoArray; HANDLE hProc = OpenProcess( PROCESS_VM_READ | PROCESS_QUERY_INFORMATION, FALSE, pid); if (hProc == 0) { THROW_LAST_WINDOWS_ERROR(); } //Populate the process environment block NtDll ntDll; PEB peb; AutoArray procInfoBuf = ntDll.NtQueryInformationProcess( ProcessBa"], "incident_type": "pr_stale", "source": "https://codereview.stackexchange.com/questions/281"}
{"question": "I started out with the best of intentions, but this form got hacky real fast. It's purpose is to serve as a create new Student form. Also, if you want to view an existing Students information. Think of it as the CRU of CRUD. Here it is: using System; using System.Collections.Generic; using System.ComponentModel; using System.Data; using System.Drawing; using System.Linq; using System.Text; using System.Windows.Forms; using Tutomentor.Branding; using Tutomentor.Data.Repositories; namespace Tutomentor.UI.Students { public partial class StudentInformation : Form { StudentRepository repo = new StudentRepository(); bool IsCreating = false; Student student; public StudentInformation() { Initialize", "answer": "private void SaveInformation() { if (IsCreating) { Student newStudent = new Student(); repo.Add(newStudent); } Int64 gradeId = Convert.ToInt64(cmbGradeParalelo.SelectedValue); newStudent.IDGrade = gradeId; newStudent.RUDE = Convert.ToInt64(txtRude.Text); /*Parents information.*/ newStudent.FatherName = txtNombrePadre.Text; newStudent.FatherProfession = txtProfesionPadre.Text; newStudent.MobilePhoneFather = FormatPhoneNumber(txtCelularPadre.Text); newStudent.PlaceofWorkFather = txtLugarDeTrabajoPadre.Text; newStudent.MotherName = txtNombreMadre.Text; newStudent.MotherProfession = txtProfesionMadre.Text; newStudent.MobilePhoneMother = FormatPhoneNumber(txtCelularMadre.Text); newStudent.PlaceofWorkMother = txtLugarDeTrabajoMadre.Text; /*newStudent information*/ newStudent.Name = txtNombre.Text; newStudent.FatherLastName = txtApellidoPaterno.Text; newStudent.MotherLasteName = txtApellidoMaterno.Text; newStudent.DateOfBirth = dtpFechaNacimiento.Value.ToShortDateString(); newStudent.PlaceOfBirth = txtLugarNacimiento.Text; newStudent.Sex = sexoMasculino.Checked ? sexoMasculino.Text : sexoFemenino.Text; newStudent.Telephone = FormatPhoneNumber(txtTelefono.Text); newStudent.MobilePhone = FormatPhoneNumber(txtCelular.Text); newStudent.Address = txtDireccion.Text; newStudent.Carnet = FormatPhoneNumber(txtCarnet.Text); newStudent.Observations = txtObservaciones.Text; repo.Save(); MessageBo", "contexts": ["I started out with the best of intentions, but this form got hacky real fast. It's purpose is to serve as a create new Student form. Also, if you want to view an existing Students information. Think of it as the CRU of CRUD. Here it is: using System; using System.Collections.Generic; using System.ComponentModel; using System.Data; using System.Drawing; using System.Linq; using System.Text; using System.Windows.Forms; using Tutomentor.Branding; using Tutomentor.Data.Repositories; namespace Tutomentor.UI.Students { public partial class StudentInformation : Form { StudentRepository repo = new StudentRepository(); bool IsCreating = false; Student student; public StudentInformation() { InitializeComponent(); LoadComboBoxes(); LoadBranding(); IsCreating = true; } public StudentInformation(int studentID) { InitializeComponent(); LoadComboBoxes(); LoadBranding(); student = repo.FindStudent(studentID); LoadStudentInformation(student); } private void LoadComboBoxes() { cmbGrade.DisplayMember = \""], "incident_type": "pr_stale", "source": "https://codereview.stackexchange.com/questions/343"}
{"question": "I wrote a bunch of Ruby code for a book project I've just finished. One criticism is that it is fine code but not very \"ruby like\". I agree my style was simplified for communication reasons, and although it's procedural code, it still feels \"ruby-like\" to me. For the representative example below, any ideas on making it more \"Ruby like\"? # Genetic Algorithm in the Ruby Programming Language # The Clever Algorithms Project: http://www.CleverAlgorithms.com # (c) Copyright 2010 Jason Brownlee. Some Rights Reserved. # This work is licensed under a Creative Commons Attribution-Noncommercial-Share Alike 2.5 Australia License. def onemax(bitstring) sum = 0 bitstring.size.times {|i| sum+=1 if bitstrin", "answer": "class Individual include Comparable attr_reader :bitstring, :fitness def initialize(bitstring) @bit_string = bitstring @fitness = onemax(bitstring) end def (other) fitness other.fitness end end", "contexts": ["I wrote a bunch of Ruby code for a book project I've just finished. One criticism is that it is fine code but not very \"ruby like\". I agree my style was simplified for communication reasons, and although it's procedural code, it still feels \"ruby-like\" to me. For the representative example below, any ideas on making it more \"Ruby like\"? # Genetic Algorithm in the Ruby Programming Language # The Clever Algorithms Project: http://www.CleverAlgorithms.com # (c) Copyright 2010 Jason Brownlee. Some Rights Reserved. # This work is licensed under a Creative Commons Attribution-Noncommercial-Share Alike 2.5 Australia License. def onemax(bitstring) sum = 0 bitstring.size.times {|i| sum+=1 if bitstring[i].chr=='1'} return sum end def random_bitstring(num_bits) return (0...num_bits).inject(\"\"){|s,i| s<<((rand<0.5) ? \"1\" : \"0\")} end def binary_tournament(pop) i, j = rand(pop.size), rand(pop.size) j = rand(pop.size) while j==i return (pop[i][:fitness] > pop[j][:fitness]) ? pop[i] : pop[j] end def p"], "incident_type": "pr_stale", "source": "https://codereview.stackexchange.com/questions/354"}
{"question": "I'm new to Hibernate so I need some advice/direction on doing Transactions. I have a DAO like public class MyDao extends HibernateDaoSupport implements IMyDao { @Override public Foo getFoo(int id) { return (Foo)getHibernateTemplate().load(Foo.class, id); } } With this setup (using HibernateDaoSupport), will Hibernate/Spring handle transactions for me? Some of the examples I see say yes, others show using Transaction tx = getHibernateTemplate().getSessionFactory().getCurrentSession().beginTransaction(); to get a Transaction in every DAO method. Right now I'm assuming my minimal DAO is correct but I want to do a \"larger\" transaction that includes a couple of Hibernate calls in one method. Woul", "answer": "class Individual include Comparable attr_reader :bitstring, :fitness def initialize(bitstring) @bit_string = bitstring @fitness = onemax(bitstring) end def (other) fitness other.fitness end end", "contexts": ["I'm new to Hibernate so I need some advice/direction on doing Transactions. I have a DAO like public class MyDao extends HibernateDaoSupport implements IMyDao { @Override public Foo getFoo(int id) { return (Foo)getHibernateTemplate().load(Foo.class, id); } } With this setup (using HibernateDaoSupport), will Hibernate/Spring handle transactions for me? Some of the examples I see say yes, others show using Transaction tx = getHibernateTemplate().getSessionFactory().getCurrentSession().beginTransaction(); to get a Transaction in every DAO method. Right now I'm assuming my minimal DAO is correct but I want to do a \"larger\" transaction that includes a couple of Hibernate calls in one method. Would I use the manual Transaction method there? Do I have to use it everywhere? Thanks."], "incident_type": "pr_stale", "source": "https://codereview.stackexchange.com/questions/356"}
{"question": "I have a stored procedure that looks up an article based on the article's title. But I also need to increment a column in the same table that counts the number of times the article has been viewed. Trying to be as efficient as possible, I wanted a way to do this without performing multiple lookups. Someone pointed out the newer OUTPUT clause, which I've used below. I'm just wondering if I'm using it in the most efficient way, if I really made it faster, and if there are any other optimizations that could be employed. DECLARE @Slug VARCHAR(250) -- Stored procedure argument -- declare @UpdatedArticle table variable DECLARE @UpdatedArticle TABLE ( ArtID INT, ArtUserID UNIQUEIDENTIFIER, ArtSubca", "answer": "CREATE PROCEDURE dbo.IncrementArtViews (@Slug varchar(250)) AS UPDATE a SET ArtViews = ArtViews + 1 OUTPUT a.ArtID, a.ArtUserID, a.ArtTitle, a.ArtHtml, a.ArtDescription, a.ArtKeywords, a.ArtLicenseID, l.licTitle, a.ArtViews, a.ArtCreated, a.ArtUpdated, s.SubID, s.SubTitle, c.CatID, c.CatTitle, sec.SecID, sec.SecTitle, u.UsrDisplayName AS UserName FROM dbo.Article a INNER JOIN dbo.Subcategory s ON a.ArtSubcategoryID = s.SubID INNER JOIN dbo.Category c ON s.SubCatID = c.CatID INNER JOIN dbo.[Section] sec ON c.CatSectionID = sec.SecID INNER JOIN dbo.[User] u ON a.ArtUserID = u.UsrID INNER JOIN dbo.License l ON a.ArtLicenseID = l.LicID WHERE a.ArtSlugHash = CHECKSUM(@Slug) AND a.ArtSlug = @Slug AND a.ArtApproved = 1", "contexts": ["I have a stored procedure that looks up an article based on the article's title. But I also need to increment a column in the same table that counts the number of times the article has been viewed. Trying to be as efficient as possible, I wanted a way to do this without performing multiple lookups. Someone pointed out the newer OUTPUT clause, which I've used below. I'm just wondering if I'm using it in the most efficient way, if I really made it faster, and if there are any other optimizations that could be employed. DECLARE @Slug VARCHAR(250) -- Stored procedure argument -- declare @UpdatedArticle table variable DECLARE @UpdatedArticle TABLE ( ArtID INT, ArtUserID UNIQUEIDENTIFIER, ArtSubcategoryID INT, ArtTitle VARCHAR(250), ArtHtml VARCHAR(MAX), ArtDescription VARCHAR(350), ArtKeywords VARCHAR(250), ArtLicenseID VARCHAR(10), ArtViews BIGINT, ArtCreated DATETIME2(7), ArtUpdated DATETIME2(7) ); UPDATE Article SET ArtViews = ArtViews + 1 OUTPUT INSERTED.ArtID, INSERTED.ArtUserID, inser"], "incident_type": "pr_stale", "source": "https://codereview.stackexchange.com/questions/415"}
{"question": "I wrote the following little shell script and published it on GitHub . In the repo there's also a README file that explains how to use it in more detail. This is the first time I open-sourced/published something I wrote, so I'm interested whether you think that this code is ready for the public. Some pointers, but feel free to add your own thoughts: Does it look professional? If not, what would need to be done? Are the comments too much? Was it ok to publish it, although I know that under some circumstances it doesn't work (I wrote about that in the README)? # random xkcd wallpaper: gets a random xkcd comic from xkcd.com and sets it as the desktop background. #!/bin/bash # /random/comic redi", "answer": "#!/bin/bash cd \"`dirname \"$0\"`\" || exit [ 0 = \"$#\" ] && set -- gconftool-2 --set --type=string /desktop/gnome/background/picture_filename url=\"`curl -sL http://dynamic.xkcd.com/random/comic/ | grep -om1 'http://imgs.xkcd.com/comics/[^.]*\\.[a-z]*'`\" img=\"$PWD/xkcd-wallpaper.${url##*.}\" curl -so \"$img\" --fail \"$url\" && \"$@\" \"$img\"", "contexts": ["I wrote the following little shell script and published it on GitHub . In the repo there's also a README file that explains how to use it in more detail. This is the first time I open-sourced/published something I wrote, so I'm interested whether you think that this code is ready for the public. Some pointers, but feel free to add your own thoughts: Does it look professional? If not, what would need to be done? Are the comments too much? Was it ok to publish it, although I know that under some circumstances it doesn't work (I wrote about that in the README)? # random xkcd wallpaper: gets a random xkcd comic from xkcd.com and sets it as the desktop background. #!/bin/bash # /random/comic redirects to random comic. Wget gets the index.html of the comic. wget http://dynamic.xkcd.com/random/comic/ echo $(pwd) #Searches the line in the index.html file that points to the url where the actual comic is placed. #The image urls are of the form: http://imgs.xkcd.com/comics/.'name of comic'.(png |"], "incident_type": "pr_stale", "source": "https://codereview.stackexchange.com/questions/428"}
{"question": "I'm new into Javascript, and I'm not sure that is a good approach. The code works, and does what I need it to do but I'm sure I didn't do the things the right way. Can you give me feedback about the implementation idea and code? So, let's say that in index.html I have the following code into body section. <script type=\"text/javascript\" src=\"js/main.js\" language=\"javascript\"></script> The content of the main.js file is the following: document.write('<script language=\"javascript\" type=\"text/javascript\" >'); function loaded() { } loaded(); document.write('</script>'); I know that using document.write it is not a smart thing at all. I'm sure that other things are faulty, but I'm newbie and I'm l", "answer": "// Document.write is bad document.write(' '); // use css definitions instead counter_div.setAttribute('style', 'width: 310px; height: 50px; font-family:lucida,tahoma,helvetica,arial,sans-serif; display: block; overflow:hide;'); // dont set inner html. This is bad. use DOM manipulation instead title_span.innerHTML = meter_title; // uses eval here. pass a function rather then a string setInterval(\"increment()\", interval); // forgetting to declare addCommas with `var`. This is implecetly global. addCommas = function(nStr) {", "contexts": ["I'm new into Javascript, and I'm not sure that is a good approach. The code works, and does what I need it to do but I'm sure I didn't do the things the right way. Can you give me feedback about the implementation idea and code? So, let's say that in index.html I have the following code into body section. <script type=\"text/javascript\" src=\"js/main.js\" language=\"javascript\"></script> The content of the main.js file is the following: document.write('<script language=\"javascript\" type=\"text/javascript\" >'); function loaded() { } loaded(); document.write('</script>'); I know that using document.write it is not a smart thing at all. I'm sure that other things are faulty, but I'm newbie and I'm looking for your feedback."], "incident_type": "pr_stale", "source": "https://codereview.stackexchange.com/questions/466"}
{"question": "I've recently been doing some mods to some old code I've been maintaining for a couple of years now. As part of a wider set of scripts using YAHOO YUI 2.2 (yes, that old) for dialog-style panels, I have a function that listens to click events on 3 buttons in a given panel set: addFooListeners = function (panelType) { YAHOO.util.Event.addListener(\"show\" + panelType, \"click\", showFoo, eval(ns + \".panel_\" + panelType), true); YAHOO.util.Event.addListener(\"hide\" + panelType, \"click\", hideFoo, eval(ns + \".panel_\" + panelType), true); YAHOO.util.Event.addListener(\"commit\" + panelType, \"click\", commitFoo, eval(ns + \".panel_\" + panelType), true); } This code is the result of a number of panels/dialo", "answer": "addFooListeners = function (panelType, handlers) { handlers = handlers || {}; handlers.show = handlers.show || showFoo; handlers.hide = handlers.hide || hideFoo; handlers.commit = handlers.commit || commitFoo;", "contexts": ["I've recently been doing some mods to some old code I've been maintaining for a couple of years now. As part of a wider set of scripts using YAHOO YUI 2.2 (yes, that old) for dialog-style panels, I have a function that listens to click events on 3 buttons in a given panel set: addFooListeners = function (panelType) { YAHOO.util.Event.addListener(\"show\" + panelType, \"click\", showFoo, eval(ns + \".panel_\" + panelType), true); YAHOO.util.Event.addListener(\"hide\" + panelType, \"click\", hideFoo, eval(ns + \".panel_\" + panelType), true); YAHOO.util.Event.addListener(\"commit\" + panelType, \"click\", commitFoo, eval(ns + \".panel_\" + panelType), true); } This code is the result of a number of panels/dialogs having near identical behaviour. For this round of development I've needed to add the ability to do things a little differently from time to time, so I added an object, overrides which allows me to point the show , hide and commit actions elsewhere. I came up with the following: addFooListeners ="], "incident_type": "pr_stale", "source": "https://codereview.stackexchange.com/questions/472"}
